traces/dsl_exploration_trace.json
{
  "metadata": {
    "device": "BW",
    "timestamp": "2026-06-30 16:37:32",
    "pytorch": "2.9.0",
    "triton": "3.3.0"
  },
  "kernels": {
    "per_token_quant_int8_triton": {
      "name": "per_token_quant_int8",
      "dsl": "triton",
      "iterations": [
        {
          "M": 16,
          "N": 4096,
          "num_warps": 4,
          "BLOCK_N": 4096,
          "ms": 0.0358,
          "correct": true,
          "max_diff": 0
        },
        {
          "M": 16,
          "N": 4096,
          "num_warps": 8,
          "BLOCK_N": 4096,
          "ms": 0.036,
          "correct": true,
          "max_diff": 0
        },
        {
          "M": 16,
          "N": 4096,
          "num_warps": 16,
          "BLOCK_N": 4096,
          "ms": 0.035,
          "correct": true,
          "max_diff": 0
        },
        {
          "M": 64,
          "N": 4096,
          "num_warps": 4,
          "BLOCK_N": 4096,
          "ms": 0.0347,
          "correct": true,
          "max_diff": 1
        },
        {
          "M": 64,
          "N": 4096,
          "num_warps": 8,
          "BLOCK_N": 4096,
          "ms": 0.0341,
          "correct": true,
          "max_diff": 1
        },
        {
          "M": 64,
          "N": 4096,
          "num_warps": 16,
          "BLOCK_N": 4096,
          "ms": 0.0341,
          "correct": true,
          "max_diff": 1
        },
        {
          "M": 256,
          "N": 4096,
          "num_warps": 4,
          "BLOCK_N": 4096,
          "ms": 0.0347,
          "correct": true,
          "max_diff": 1
        },
        {
          "M": 256,
          "N": 4096,
          "num_warps": 8,
          "BLOCK_N": 4096,
          "ms": 0.0346,
          "correct": true,
          "max_diff": 1
        },
        {
          "M": 256,
          "N": 4096,
          "num_warps": 16,
          "BLOCK_N": 4096,
          "ms": 0.0344,
          "correct": true,
          "max_diff": 1
        }
      ]
    },
    "fused_silu_mul_quant_triton": {
      "name": "fused_silu_mul_quant",
      "dsl": "triton",
      "iterations": [
        {
          "M": 16,
          "N": 2048,
          "num_warps": 4,
          "ms": 0.0408,
          "correct": true
        },
        {
          "M": 16,
          "N": 2048,
          "num_warps": 8,
          "ms": 0.041,
          "correct": true
        },
        {
          "M": 16,
          "N": 2048,
          "num_warps": 16,
          "ms": 0.0407,
          "correct": true
        },
        {
          "M": 64,
          "N": 2048,
          "num_warps": 4,
          "ms": 0.0407,
          "correct": true
        },
        {
          "M": 64,
          "N": 2048,
          "num_warps": 8,
          "ms": 0.0407,
          "correct": true
        },
        {
          "M": 64,
          "N": 2048,
          "num_warps": 16,
          "ms": 0.04,
          "correct": true
        },
        {
          "M": 256,
          "N": 2048,
          "num_warps": 4,
          "ms": 0.0399,
          "correct": true
        },
        {
          "M": 256,
          "N": 2048,
          "num_warps": 8,
          "ms": 0.0403,
          "correct": true
        },
        {
          "M": 256,
          "N": 2048,
          "num_warps": 16,
          "ms": 0.0404,
          "correct": true
        }
      ]
    },
    "fused_add_rmsnorm_quant_triton": {
      "name": "fused_add_rmsnorm_quant",
      "dsl": "triton",
      "iterations": [
        {
          "M": 16,
          "N": 4096,
          "num_warps": 4,
          "ms": 0.0672,
          "correct": true,
          "max_diff": 1
        },
        {
          "M": 16,
          "N": 4096,
          "num_warps": 8,
          "ms": 0.0675,
          "correct": true,
          "max_diff": 1
        },
        {
          "M": 64,
          "N": 4096,
          "num_warps": 4,
          "ms": 0.0676,
          "correct": true,
          "max_diff": 1
        },
        {
          "M": 64,
          "N": 4096,
          "num_warps": 8,
          "ms": 0.0674,
          "correct": true,
          "max_diff": 1
        },
        {
          "M": 256,
          "N": 4096,
          "num_warps": 4,
          "ms": 0.0679,
          "correct": true,
          "max_diff": 1
        },
        {
          "M": 256,
          "N": 4096,
          "num_warps": 8,
          "ms": 0.072,
          "correct": true,
          "max_diff": 1
        }
      ]
    },
    "hip_cpp": {
      "name": "all_hip",
      "dsl": "hip_cpp",
      "results": [
        {
          "M": 16,
          "N": 4096,
          "per_token_quant": {
            "baseline_ms": 0.0654,
            "hip_ms": 0.0085,
            "speedup": 7.65,
            "max_diff": 1
          },
          "fused_add_rmsnorm_quant": {
            "baseline_ms": 0.1236,
            "hip_ms": 0.0187,
            "speedup": 6.62,
            "max_diff": 1
          }
        },
        {
          "M": 64,
          "N": 4096,
          "per_token_quant": {
            "baseline_ms": 0.0637,
            "hip_ms": 0.0085,
            "speedup": 7.52,
            "max_diff": 1
          },
          "fused_add_rmsnorm_quant": {
            "baseline_ms": 0.1238,
            "hip_ms": 0.0189,
            "speedup": 6.53,
            "max_diff": 1
          }
        },
        {
          "M": 256,
          "N": 4096,
          "per_token_quant": {
            "baseline_ms": 0.0646,
            "hip_ms": 0.0107,
            "speedup": 6.02,
            "max_diff": 1
          },
          "fused_add_rmsnorm_quant": {
            "baseline_ms": 0.1269,
            "hip_ms": 0.0271,
            "speedup": 4.68,
            "max_diff": 1
          }
        }
      ]
    }
  }
}